{
  "timestamp": "2026-02-28T14:02:37Z",
  "framework": "uats",
  "framework_version": "1.1.0",
  "summary": {
    "total_specs": 1,
    "passed": 1,
    "failed": 0,
    "skipped": 0,
    "errors": 0,
    "pass_rate": 100,
    "duration_ms": 12.4
  },
  "integrity": {
    "total_hashed": 1,
    "verified": 1,
    "mismatched": 0,
    "no_hash": 0
  },
  "results": [
    {
      "spec_path": "examples/frameworks/uats/specs/health.uats.json",
      "status": "pass",
      "duration_ms": 12.4,
      "hash_verified": true,
      "hash_mismatches": [],
      "assertions_evaluated": 2,
      "assertions_passed": 2,
      "failures": [],
      "warnings": [],
      "error": null
    }
  ]
}
